{"cadence":"protected-main","conclusion":"success","obligations":[{"id":"Metriplane / required","result":"success"},{"id":"Documentation / required","result":"success"},{"id":"Security / required","result":"success"}],"recorded_at":"2026-09-14T12:51:35Z","run_id":"github-actions-set:v1:metriplane=34841145508:1;documentation=34841145530:1;security=34841145551:1","schema_version":1,"sha":"881ed699e5eed5c8f2a61e10ca15adff08c3f6f5"}
