{"cadence":"protected-main","conclusion":"failure","obligations":[{"id":"Metriplane / required","result":"failure"},{"id":"Documentation / required","result":"success"},{"id":"Security / required","result":"success"}],"recorded_at":"2026-09-25T17:16:42Z","run_id":"github-actions-set:v1:metriplane=36159239832:1;documentation=36159239764:1;security=36159240035:1","schema_version":1,"sha":"a60d0000a175343fcde3aec6e669cbf9a12864d3"}
